{
    "$schema": "http://json-schema.org/schema#",
    "type": "object",
    "properties": {
        "status": {
            "type": "string"
        },
        "policy": {
            "type": "object",
            "properties": {
                "name": {
                    "type": "string"
                },
                "description": {
                    "type": "string"
                }
            },
            "required": [
                "description",
                "name"
            ]
        },
        "findingKey": {
            "type": "string"
        },
        "findingId": {
            "type": "string"
        },
        "cloudGuardAccountId": {
            "type": "string"
        },
        "origin": {
            "type": "string"
        },
        "bundle": {
            "type": "object",
            "properties": {
                "name": {
                    "type": "string"
                },
                "description": {
                    "type": "string"
                },
                "id": {
                    "type": "integer"
                }
            },
            "required": [
                "description",
                "id",
                "name"
            ]
        },
        "reportTime": {
            "type": "string"
        },
        "rule": {
            "type": "object",
            "properties": {
                "name": {
                    "type": "string"
                },
                "ruleId": {
                    "type": "string"
                },
                "description": {
                    "type": "string"
                },
                "remediation": {
                    "type": "string"
                },
                "complianceTags": {
                    "type": "string"
                },
                "logicHash": {
                    "type": "string"
                },
                "severity": {
                    "type": "string"
                }
            },
            "required": [
                "complianceTags",
                "description",
                "logicHash",
                "name",
                "remediation",
                "ruleId",
                "severity"
            ]
        },
        "account": {
            "type": "object",
            "properties": {
                "id": {
                    "type": "string"
                },
                "name": {
                    "type": "string"
                },
                "vendor": {
                    "type": "string"
                },
                "dome9CloudAccountId": {
                    "type": "string"
                },
                "organizationalUnitId": {
                    "type": "string"
                },
                "organizationalUnitPath": {
                    "type": "string"
                }
            },
            "required": [
                "dome9CloudAccountId",
                "id",
                "name",
                "organizationalUnitId",
                "organizationalUnitPath",
                "vendor"
            ]
        },
        "region": {
            "type": "string"
        },
        "entity": {
            "type": "object",
            "properties": {
                "automountServiceAccountToken": {
                    "type": "boolean"
                },
                "imagePullSecrets": {
                    "type": "array",
                    "items": {
                        "type": "object",
                        "properties": {
                            "name": {
                                "type": "string"
                            }
                        },
                        "required": [
                            "name"
                        ]
                    }
                },
                "secrets": {
                    "type": "array",
                    "items": {
                        "type": "object",
                        "properties": {
                            "apiVersion": {
                                "type": "null"
                            },
                            "fieldPath": {
                                "type": "null"
                            },
                            "name": {
                                "type": "string"
                            },
                            "namespace": {
                                "type": "null"
                            },
                            "resourceVersion": {
                                "type": "null"
                            },
                            "uid": {
                                "type": "null"
                            }
                        },
                        "required": [
                            "apiVersion",
                            "fieldPath",
                            "name",
                            "namespace",
                            "resourceVersion",
                            "uid"
                        ]
                    }
                },
                "tags": {
                    "type": "array",
                    "items": {
                        "type": "object",
                        "properties": {
                            "key": {
                                "type": "string"
                            },
                            "value": {
                                "type": "string"
                            }
                        },
                        "required": [
                            "key",
                            "value"
                        ]
                    }
                },
                "namespace": {
                    "type": "string"
                },
                "annotations": {
                    "type": "array",
                    "items": {
                        "type": "object",
                        "properties": {
                            "key": {
                                "type": "string"
                            },
                            "value": {
                                "type": "string"
                            }
                        },
                        "required": [
                            "key",
                            "value"
                        ]
                    }
                },
                "labels": {
                    "type": "array",
                    "items": {
                        "type": "object",
                        "properties": {
                            "key": {
                                "type": "string"
                            },
                            "value": {
                                "type": "string"
                            }
                        },
                        "required": [
                            "key",
                            "value"
                        ]
                    }
                },
                "creationTime": {
                    "type": "integer"
                },
                "id": {
                    "type": "string"
                },
                "type": {
                    "type": "string"
                },
                "name": {
                    "type": "string"
                },
                "dome9Id": {
                    "type": "string"
                },
                "accountNumber": {
                    "type": "string"
                },
                "assetLabels": {
                    "type": "null"
                },
                "region": {
                    "type": "string"
                },
                "externalFindings": {
                    "type": "null"
                }
            },
            "required": [
                "accountNumber",
                "annotations",
                "assetLabels",
                "automountServiceAccountToken",
                "creationTime",
                "dome9Id",
                "externalFindings",
                "id",
                "imagePullSecrets",
                "labels",
                "name",
                "namespace",
                "region",
                "secrets",
                "tags",
                "type"
            ]
        },
        "remediationActions": {
            "type": "array"
        },
        "action": {
            "type": "string"
        },
        "additionalFields": {
            "type": "array"
        }
    },
    "required": [
        "account",
        "action",
        "additionalFields",
        "bundle",
        "cloudGuardAccountId",
        "entity",
        "findingId",
        "findingKey",
        "origin",
        "policy",
        "region",
        "remediationActions",
        "reportTime",
        "rule",
        "status"
    ]
}