{"status":"Failed","policy":{"name":"Webhooks","description":""},"findingKey":"u1mTfnUgAbWZc4FRA8l9pA","findingId":"u1mTfnUgAbWZc4FRA8l9pA","cloudGuardAccountId":"51722","origin":"Compliance Engine","bundle":{"name":"CIS Kubernetes Benchmark v1.6.1","description":"Automated Validation of Kubernetes CIS Benchmark v1.6.1 Prescriptive guidance for establishing a secure configuration posture for Kubernetes 1.6.1\nFor additional reference: https://www.cisecurity.org/benchmark/kubernetes/","id":-70},"reportTime":"2023-06-09T11:00:31.243Z","rule":{"name":"Ensure that Service Account Tokens are only mounted where necessary (RBAC)","ruleId":"D9.K8S.IAM.37","description":"Service accounts tokens should not be mounted in pods except where the workload running in the pod explicitly needs to communicate with the API server. Mounting service account tokens inside pods can provide an avenue for privilege escalation attacks where an attacker is able to compromise a single pod in the cluster. Avoiding mounting these tokens removes this attack avenue.","remediation":"Modify the definition of pods and service accounts which do not need to mount service account tokens to disable it.\n\n**References**\n1. https://kubernetes.io/docs/tasks/configure-pod-container/configure-service-account/","complianceTags":"5.1.6","logicHash":"cSTcHpdCLI84ZSeS/rDcxQ","severity":"Low"},"account":{"id":"5af13ab5-72ed-43b6-9544-33c9236d62f0","name":"nu-openshift-cluster","vendor":"Kubernetes","dome9CloudAccountId":"5af13ab5-72ed-43b6-9544-33c9236d62f0","organizationalUnitId":"00000000-0000-0000-0000-000000000000","organizationalUnitPath":""},"region":"Global","entity":{"automountServiceAccountToken":true,"imagePullSecrets":[{"name":"my-harbor-redis-dockercfg-q4tmx"}],"secrets":[{"apiVersion":null,"fieldPath":null,"name":"my-harbor-redis-dockercfg-q4tmx","namespace":null,"resourceVersion":null,"uid":null}],"tags":[{"key":"app.kubernetes.io/instance","value":"my-harbor"},{"key":"app.kubernetes.io/managed-by","value":"Helm"},{"key":"app.kubernetes.io/name","value":"redis"},{"key":"helm.sh/chart","value":"redis-17.4.2"}],"namespace":"harbor","annotations":[{"key":"meta.helm.sh/release-name","value":"my-harbor"},{"key":"meta.helm.sh/release-namespace","value":"harbor"}],"labels":[{"key":"app.kubernetes.io/instance","value":"my-harbor"},{"key":"app.kubernetes.io/managed-by","value":"Helm"},{"key":"app.kubernetes.io/name","value":"redis"},{"key":"helm.sh/chart","value":"redis-17.4.2"}],"creationTime":1676446442,"id":"f73ee6a0-d0e8-4fa3-9c0b-43ceff4f129e","type":"KubernetesServiceAccount","name":"my-harbor-redis","dome9Id":"11|5af13ab5-72ed-43b6-9544-33c9236d62f0|ServiceAccount|f73ee6a0-d0e8-4fa3-9c0b-43ceff4f129e","accountNumber":"5af13ab5-72ed-43b6-9544-33c9236d62f0","assetLabels":null,"region":"Global","externalFindings":null},"remediationActions":[],"action":"Detect","additionalFields":[]}